{
  "$schema": "./source.schema.json",
  "schemaVersion": 1,
  "kind": "text-to-ui-resource-sources",
  "documents": [
    {
      "path": "references/requirement-spec.md",
      "policy": "generated-compatibility-aggregate",
      "parts": [
        "requirements.overview",
        "requirements.contents",
        "requirements.intake-principle",
        "requirements.three-decision-layers",
        "requirements.adaptive-question-policy",
        "requirements.user-input-guidance",
        "requirements.first-preview-planning",
        "requirements.generated-requirement-contract",
        "requirements.fixed-harmonyos-defaults-from-native-references",
        "requirements.anti-patterns"
      ],
      "baselineSha256": "b9960810610843f0802070264545b0ebf14b2ce21949bb7fbcc19b44e72451b1",
      "baselineBytes": 13930
    },
    {
      "path": "references/layout-system.md",
      "policy": "generated-compatibility-aggregate",
      "parts": [
        "layout.overview",
        "layout.window-foundation",
        "layout.application-shell",
        "layout.page-spacing",
        "layout.grid",
        "layout.resize-rules",
        "layout.pixso-mapping",
        "layout.html-mapping",
        "layout.decisions-to-confirm"
      ],
      "baselineSha256": "1b63fe82134fcdc2e36a4b72edc41aa2d08908f700f84d705d6e2452089c6a9e",
      "baselineBytes": 20610
    },
    {
      "path": "references/harmonyos-layout-patterns.md",
      "policy": "generated-compatibility-aggregate",
      "parts": [
        "patterns.overview",
        "patterns.shared-window-anatomy",
        "patterns.global-title-layer",
        "patterns.left-brand-anchor",
        "patterns.primary-shell-global-primary-slot",
        "patterns.context-area",
        "patterns.right-action-and-window-area",
        "patterns.final-pane-leading-slot",
        "patterns.approved-shell-patterns",
        "patterns.reusable-pattern-primary-navigation-shell",
        "patterns.pattern-a-two-pane-navigation-content",
        "patterns.reusable-pattern-secondary-page-hierarchy",
        "patterns.pattern-b-three-pane-navigation-list-detail",
        "patterns.pattern-c-navigation-tool-workspace",
        "patterns.pattern-d-optional-inspector",
        "patterns.pane-behavior",
        "patterns.primary-navigation",
        "patterns.secondary-pane",
        "patterns.main-content",
        "patterns.inspector",
        "patterns.surface-and-divider-behavior",
        "patterns.scrolling",
        "patterns.system-ui-boundary",
        "patterns.shell-selection-rule"
      ],
      "baselineSha256": "1f9aa5db712efd953f93c896c32cf5ced7aeabd3b92b51f3f348b0f79b447070",
      "baselineBytes": 26210
    },
    {
      "path": "references/interaction-spec.md",
      "policy": "generated-compatibility-aggregate",
      "parts": [
        "interaction.overview",
        "interaction.scope-and-source-levels",
        "interaction.official-platform-principles",
        "interaction.pointer-and-mouse",
        "interaction.keyboard-and-focus",
        "interaction.common-shortcuts",
        "interaction.navigation-and-selection",
        "interaction.window-and-resize-behavior",
        "interaction.overlay-selection",
        "interaction.forms-and-validation",
        "interaction.state-feedback",
        "interaction.undo-and-destructive-actions",
        "interaction.motion-sound-and-accessibility",
        "interaction.interactive-frontend-demonstration",
        "interaction.per-interaction-record",
        "interaction.interaction-qa-gate"
      ],
      "baselineSha256": "0c019113ceef82e2557ec3e0e518d4f7b66e5d803ba2e5cefe72a51674961cbf",
      "baselineBytes": 21085
    },
    {
      "path": "references/components/page-composition.md",
      "policy": "generated-compatibility-aggregate",
      "parts": [
        "composition.overview",
        "composition.content-recipes-decide-before-binding",
        "composition.style-and-behavior-plans",
        "composition.executable-html-business-composites",
        "composition.plans",
        "composition.pattern-owned-navigation-shells",
        "composition.stroke-ownership"
      ],
      "baselineSha256": "f7370603361d201da67e27843f5b0da97ce2284380fb3f3a1bb235d183a95633",
      "baselineBytes": 13839
    },
    {
      "path": "references/page-blueprint-design.md",
      "policy": "generated-compatibility-aggregate",
      "parts": [
        "blueprint.overview",
        "blueprint.required-decisions",
        "blueprint.design-before-assembly",
        "blueprint.pattern-b-assembly-decisions",
        "blueprint.minimal-shape"
      ],
      "baselineSha256": "077311e7da77d04c3cca26512c27302aaaabf18e257bb7808f5e0e2592cf4309",
      "baselineBytes": 4552
    },
    {
      "path": "references/page-design-guidance.md",
      "policy": "generated-compatibility-aggregate",
      "parts": [
        "design.overview",
        "design.start-with-the-task-not-the-inventory",
        "design.design-at-the-real-content-width",
        "design.visual-alignment-and-grouping",
        "design.reuse-controls-design-missing-business-composites",
        "design.one-deliberate-first-preview"
      ],
      "baselineSha256": "400a6c9db73b12d5f426bbc39b88e9dacbde224ff703cfbe1149635b17dd3875",
      "baselineBytes": 4136
    },
    {
      "path": "references/component-specs-extended.md",
      "policy": "generated-compatibility-aggregate",
      "parts": [
        "supplement.overview",
        "supplement.universal-contract",
        "supplement.navigation-and-disclosure",
        "supplement.overlays-and-commands",
        "supplement.form-composition",
        "supplement.loading-data-and-dates",
        "supplement.specialized-content-and-layout"
      ],
      "baselineSha256": "a4f77749fb20832896ac483372f3683339e94bba940ac178fe96664fe8679a5d",
      "baselineBytes": 14448
    },
    {
      "path": "references/components/titlebar-segments.md",
      "policy": "generated-compatibility-aggregate",
      "parts": [
        "titlebar.overview",
        "titlebar.scenarios",
        "titlebar.title-typography",
        "titlebar.trailing-inset",
        "titlebar.executable-html-slots",
        "titlebar.generated-titlebar-scene"
      ],
      "baselineSha256": "2c19061b781307de78fb71b71e5a34bbf55ff07a056c518d521b0780754509b2",
      "baselineBytes": 10972
    },
    {
      "path": "references/components/local-component-delivery.md",
      "policy": "generated-compatibility-aggregate",
      "parts": [
        "delivery.overview",
        "delivery.reading",
        "delivery.project-output",
        "delivery.prepare",
        "delivery.styles",
        "delivery.calling",
        "delivery.pixso"
      ],
      "baselineSha256": "4868a10e8c01443ba6b674c7b84ef520c88f4f3cc9d38521bc462387d00521c6",
      "baselineBytes": 5628
    },
    {
      "path": "references/pixso-fidelity-import-pipeline.md",
      "policy": "generated-compatibility-aggregate",
      "parts": [
        "pixso-pipeline.overview",
        "pixso-pipeline.normal-fast-path-and-diagnostic-boundary",
        "pixso-pipeline.start-an-isolated-run",
        "pixso-pipeline.capture-browser-computed-evidence",
        "pixso-pipeline.keep-two-evidence-layers-and-one-pixso-output",
        "pixso-pipeline.compile-dom-visual-ir-only-from-the-current-run",
        "pixso-pipeline.resolve-components-without-changing-geometry",
        "pixso-pipeline.execute-transactionally",
        "pixso-pipeline.acceptance-gates"
      ],
      "baselineSha256": "0ef07b9b12db4109d6af81c5035fec1ee54b5c254190a8f63766ad4cc25e03ba",
      "baselineBytes": 21033
    },
    {
      "path": "references/pixso-mcp.md",
      "policy": "generated-compatibility-aggregate",
      "parts": [
        "pixso-mcp.overview",
        "pixso-mcp.connection",
        "pixso-mcp.target-page-and-path-preflight-failure-derived",
        "pixso-mcp.creation-sequence",
        "pixso-mcp.registered-reuse-performance-and-icon-gates",
        "pixso-mcp.page-binding-bridge-token",
        "pixso-mcp.token-gate",
        "pixso-mcp.binding-audit",
        "pixso-mcp.existing-design-and-html-handoff",
        "pixso-mcp.failure-handling",
        "pixso-mcp.deliverable-reference"
      ],
      "baselineSha256": "8c74af173188a08fdd2934c81bb6dd0d9311e062173d92988cbb2fb7dd596d8e",
      "baselineBytes": 20455
    },
    {
      "path": "references/pixso-native-scene.md",
      "policy": "generated-compatibility-aggregate",
      "parts": [
        "pixso-scene.overview",
        "pixso-scene.html-computed-visual-state",
        "pixso-scene.dom-visual-ir",
        "pixso-scene.scene",
        "pixso-scene.surface",
        "pixso-scene.divider-ownership",
        "pixso-scene.section-6",
        "pixso-scene.section-7",
        "pixso-scene.section-8",
        "pixso-scene.mcp",
        "pixso-scene.mcp-10",
        "pixso-scene.section-11"
      ],
      "baselineSha256": "ac89fe26c495feb0f3909fd13f101711a5818a14a307b46a797607ffa33593d4",
      "baselineBytes": 19951
    },
    {
      "path": "references/pixso-import-details.md",
      "policy": "generated-compatibility-aggregate",
      "parts": [
        "pixso-detail.overview",
        "pixso-detail.html-text-sizing-and-truncation",
        "pixso-detail.icon-sizing-stroke-and-hot-zone-contract",
        "pixso-detail.cross-source-mapping-registry",
        "pixso-detail.typography-mapping-policy",
        "pixso-detail.pixso-component-facts-sync"
      ],
      "baselineSha256": "d96e2bfd586be25acca45d69c007804da91e51057dcbb3eb11ef58764176af07",
      "baselineBytes": 10183
    }
  ],
  "resources": [
    {
      "id": "requirements.overview",
      "path": "references/resources/requirements/overview.md",
      "purpose": "Adaptive Requirement Specification",
      "stage": [],
      "appliesTo": {},
      "requires": [],
      "source": {
        "aggregate": "references/requirement-spec.md",
        "ordinal": 0,
        "linkBase": "references"